<?xml version="1.0" encoding="UTF-8"?>
<properties xmlns:xsi="http://www.w3.org/2001/XMLSchema-instance" xsi:noNamespaceSchemaLocation="properties.xsd">
   <property action="create">
      <refagent>pr003</refagent>
      <title>titre 1</title>
      <description>description 1</description>
      <price>12345</price>
      <address>voici une adresse</address>
      <bedroom>2</bedroom>
      <url>http://www.example.com/bienavendre12</url>
   </property>
   <property action="update">
      <refagent>dssdds</refagent>
      <title>titre 2</title>
      <description>description 2</description>
      <price>67890</price>
      <address>rue du chemin</address>
      <bedroom>3</bedroom>
      <url>http://www.example.com/bienavendre12</url>
   </property>
   <property action="update">
      <refagent>pr0045</refagent>
      <title>titre 3</title>
      <description>description 3</description>
      <price>13579.45</price>
      <address>voici une adresse</address>
      <bedroom>3</bedroom>
      <url>http://www.example.com/bienavendre12</url>
   </property>
   <property action="delete">
      <refagent>pr0045</refagent>
   </property>
</properties>